<?xml version="1.0" encoding="UTF-8"?>
<DeviceBitTypeInfo xmlns:xsi="http://www.w3.org/2001/XMLSchema-instance" xsi:noNamespaceSchemaLocation="DeviceBitTypeInfo.xsd">
	<DeviceBitTypes>
	<DeviceBitType>
			<DeviceType>联锁区</DeviceType>
			<DeviceSubType>联锁区</DeviceSubType>
			<BitType>
				<Name>中心控</Name>
				<Value>1</Value>
				<Tip>中心控</Tip>
			</BitType>
			<BitType>
				<Name>车站控</Name>
				<Value>2</Value>
				<Tip>车站控</Tip>
			</BitType>
			<BitType>
				<Name>联锁控</Name>
				<Value>3</Value>
				<Tip>联锁控</Tip>
			</BitType>
			<BitType>
				<Name>中心故障</Name>
				<Value>4</Value>
				<Tip>中心故障</Tip>
			</BitType>
		</DeviceBitType>
		<DeviceBitType>
			<DeviceType>信号机</DeviceType>
			<DeviceSubType>信号机</DeviceSubType>
			<BitType>
				<Name>封锁</Name>
				<Value>1</Value>
				<Tip>信号机封锁</Tip>
			</BitType>
			<BitType>
				<Name>红灯</Name>
				<Value>2</Value>
				<Tip>红灯</Tip>
			</BitType>
			<BitType>
				<Name>绿灯</Name>
				<Value>3</Value>
				<Tip>绿灯</Tip>
			</BitType>
			<BitType>
				<Name>黄灯</Name>
				<Value>4</Value>
				<Tip>黄灯</Tip>
			</BitType>
		</DeviceBitType>
		<DeviceBitType>
			<DeviceType>物理区段</DeviceType>
			<DeviceSubType>物理区段</DeviceSubType>
			<BitType>
				<Name>封锁</Name>
				<Value>5</Value>
				<Tip>物理区段封锁</Tip>
			</BitType>
			<BitType>
				<Name>物理占用</Name>
				<Value>6</Value>
				<Tip>物理占用</Tip>
			</BitType>
		</DeviceBitType>
		<DeviceBitType>
			<DeviceType>股道</DeviceType>
			<DeviceSubType>股道</DeviceSubType>
			<BitType>
				<Name>逻辑占用</Name>
				<Value>7</Value>
				<Tip>逻辑占用</Tip>
			</BitType>
		</DeviceBitType>
	</DeviceBitTypes>
</DeviceBitTypeInfo>
